{
  "citation": {
    "doi": "10.1038/s41598-026-42395-1",
    "pmcid": "PMC13171905",
    "pmid": "41813773",
    "title": "Vancomycin therapeutic drug monitoring is associated with reduced toxicity in ICU patients: a MIMIC-IV retrospective study."
  },
  "coder": {
    "coder_id": "primary_coder_1",
    "notes": "Single-primary-coder structured transformation; no independent recode available.",
    "review_date": "2026-08-01"
  },
  "database": "MIMIC-IV",
  "dimensions": {
    "event_semantics_map": {
      "evidence": [],
      "status": "missing"
    },
    "identity_rule": {
      "evidence": [],
      "status": "missing"
    },
    "required_metadata": {
      "evidence": [
        {
          "location": "Expanded main-text coding packet",
          "short_note": "intravenous route",
          "source": "main_text"
        }
      ],
      "status": "reported"
    },
    "source_layer": {
      "evidence": [],
      "status": "missing"
    },
    "time_origin_window": {
      "evidence": [
        {
          "location": "Expanded main-text coding packet",
          "short_note": "after ICU admission/during ICU treatment",
          "source": "main_text"
        }
      ],
      "status": "reported"
    }
  },
  "evidence_scope": {
    "article_repository": "none_linked",
    "main_text": "reviewed",
    "supplement": "reviewed"
  },
  "operational_indicators": {
    "complete_executable_operator": false,
    "executable_identity": false,
    "named_native_source": false
  },
  "repository": {
    "hash_reported": false,
    "url_reported": false,
    "urls": [],
    "version_reported": false
  },
  "schema_version": "1.0.0",
  "study_id": "mimic-medication-03"
}
