{
  "citation": {
    "doi": "10.1186/s12879-025-11963-7",
    "pmcid": "PMC12625647",
    "pmid": "41249990",
    "title": "Association between early prophylactic heparin therapy and mortality in patients with septic shock secondary to respiratory infections: analysis based on MIMIC-IV database."
  },
  "coder": {
    "coder_id": "primary_coder_1",
    "notes": "Single-primary-coder structured transformation; no independent recode available.",
    "review_date": "2026-08-01"
  },
  "database": "MIMIC-IV",
  "dimensions": {
    "event_semantics_map": {
      "evidence": [],
      "status": "missing"
    },
    "identity_rule": {
      "evidence": [],
      "status": "missing"
    },
    "required_metadata": {
      "evidence": [
        {
          "location": "Expanded main-text coding packet",
          "short_note": "time to first dose and cumulative doses",
          "source": "main_text"
        }
      ],
      "status": "reported"
    },
    "source_layer": {
      "evidence": [],
      "status": "missing"
    },
    "time_origin_window": {
      "evidence": [
        {
          "location": "Expanded main-text coding packet",
          "short_note": "first 72 h after ICU admission",
          "source": "main_text"
        }
      ],
      "status": "reported"
    }
  },
  "evidence_scope": {
    "article_repository": "none_linked",
    "main_text": "reviewed",
    "supplement": "reviewed"
  },
  "operational_indicators": {
    "complete_executable_operator": false,
    "executable_identity": false,
    "named_native_source": false
  },
  "repository": {
    "hash_reported": false,
    "url_reported": false,
    "urls": [],
    "version_reported": false
  },
  "schema_version": "1.0.0",
  "study_id": "mimic-medication-32"
}
