{
  "citation": {
    "doi": "10.1186/s40001-025-02660-x",
    "pmcid": "PMC12102817",
    "pmid": "40410920",
    "title": "Analysis of the heterogeneous treatment effect of vasoactive drug dosage and time on hospital mortality across different sepsis phenotypes: a retrospective cohort study."
  },
  "coder": {
    "coder_id": "primary_coder_1",
    "notes": "Single-primary-coder structured transformation; no independent recode available.",
    "review_date": "2026-08-01"
  },
  "database": "MIMIC-IV",
  "dimensions": {
    "event_semantics_map": {
      "evidence": [],
      "status": "missing"
    },
    "identity_rule": {
      "evidence": [],
      "status": "missing"
    },
    "required_metadata": {
      "evidence": [
        {
          "location": "Expanded main-text coding packet",
          "short_note": "hourly norepinephrine-equivalent dose",
          "source": "main_text"
        }
      ],
      "status": "reported"
    },
    "source_layer": {
      "evidence": [],
      "status": "missing"
    },
    "time_origin_window": {
      "evidence": [
        {
          "location": "Expanded main-text coding packet",
          "short_note": "0 to 72 h from initial vasoactive use",
          "source": "main_text"
        }
      ],
      "status": "reported"
    }
  },
  "evidence_scope": {
    "article_repository": "none_linked",
    "main_text": "reviewed",
    "supplement": "reviewed"
  },
  "operational_indicators": {
    "complete_executable_operator": false,
    "executable_identity": false,
    "named_native_source": false
  },
  "repository": {
    "hash_reported": false,
    "url_reported": false,
    "urls": [],
    "version_reported": false
  },
  "schema_version": "1.0.0",
  "study_id": "mimic-medication-36"
}
