{
  "citation": {
    "doi": "10.1186/s12876-025-03763-9",
    "pmcid": "PMC11931801",
    "pmid": "40128664",
    "title": "Optimizing outcomes in acute pancreatitis: the impact of of heparin therapy duration on mortality in a multi-center retrospective study."
  },
  "coder": {
    "coder_id": "primary_coder_1",
    "notes": "Single-primary-coder structured transformation; no independent recode available.",
    "review_date": "2026-08-01"
  },
  "database": "MIMIC-IV",
  "dimensions": {
    "event_semantics_map": {
      "evidence": [],
      "status": "missing"
    },
    "identity_rule": {
      "evidence": [],
      "status": "missing"
    },
    "required_metadata": {
      "evidence": [],
      "status": "missing"
    },
    "source_layer": {
      "evidence": [],
      "status": "missing"
    },
    "time_origin_window": {
      "evidence": [
        {
          "location": "Expanded main-text coding packet",
          "short_note": "hospital stay; typically within 24 h",
          "source": "main_text"
        }
      ],
      "status": "reported"
    }
  },
  "evidence_scope": {
    "article_repository": "none_linked",
    "main_text": "reviewed",
    "supplement": "none_linked"
  },
  "operational_indicators": {
    "complete_executable_operator": false,
    "executable_identity": false,
    "named_native_source": false
  },
  "repository": {
    "hash_reported": false,
    "url_reported": false,
    "urls": [],
    "version_reported": false
  },
  "schema_version": "1.0.0",
  "study_id": "mimic-medication-12"
}
