{
  "citation": {
    "doi": "10.2147/OAEM.S539104",
    "pmcid": "PMC12506791",
    "pmid": "41069398",
    "title": "Early Prophylactic Anticoagulation and In-Hospital Mortality in Patients with Severe Acute Pancreatitis: A Retrospective Cohort Study."
  },
  "coder": {
    "coder_id": "primary_coder_1",
    "notes": "Single-primary-coder structured transformation; no independent recode available.",
    "review_date": "2026-08-01"
  },
  "database": "MIMIC-IV",
  "dimensions": {
    "event_semantics_map": {
      "evidence": [],
      "status": "missing"
    },
    "identity_rule": {
      "evidence": [],
      "status": "missing"
    },
    "required_metadata": {
      "evidence": [
        {
          "location": "Expanded main-text coding packet",
          "short_note": "5000 U subcutaneous heparin",
          "source": "main_text"
        }
      ],
      "status": "reported"
    },
    "source_layer": {
      "evidence": [],
      "status": "missing"
    },
    "time_origin_window": {
      "evidence": [
        {
          "location": "Expanded main-text coding packet",
          "short_note": "first 24 h after ICU admission",
          "source": "main_text"
        }
      ],
      "status": "reported"
    }
  },
  "evidence_scope": {
    "article_repository": "none_linked",
    "main_text": "reviewed",
    "supplement": "none_linked"
  },
  "operational_indicators": {
    "complete_executable_operator": false,
    "executable_identity": false,
    "named_native_source": false
  },
  "repository": {
    "hash_reported": false,
    "url_reported": false,
    "urls": [],
    "version_reported": false
  },
  "schema_version": "1.0.0",
  "study_id": "mimic-medication-39"
}
